{
  "schema_version": 2,
  "domain": "youtube.com",
  "field_tested": {
    "date": "2026-04-28",
    "profile": "clean signed-out browser-harness Chrome profile",
    "web_client": "WEB 2.20260427.01.00",
    "hl": "en-GB",
    "gl": "US",
    "contract_updated": "2026-04-28"
  },
  "path_types": [
    "api",
    "browser",
    "hybrid",
    "static",
    "local"
  ],
  "forbidden": [
    "official YouTube Data API",
    "Google OAuth credential flow",
    "silent browser cookie reads for committed artifacts",
    "raw playback URLs",
    "signatureCipher",
    "caption baseUrl in logs",
    "visitorData in logs",
    "account mutation without explicit user request",
    "yt-dlp media download modes",
    "yt-dlp browser cookie import for committed artifacts",
    "unredacted Innertube request keys in fixtures or receipts"
  ],
  "execution_policy": {
    "stop_on": [
      "success"
    ],
    "fallback_on": [
      "not_available",
      "not_found",
      "empty_result",
      "parse_error",
      "blocked",
      "timeout",
      "unsupported_shape"
    ],
    "never_fallback_to": [
      "official YouTube Data API",
      "OAuth flow",
      "silent browser cookie read",
      "account mutation",
      "media download unless explicitly requested",
      "yt-dlp media download mode",
      "yt-dlp browser-cookie import"
    ],
    "receipt_required": [
      "primitive_id",
      "path_type",
      "source_url_or_endpoint_shape",
      "status_or_exit_code",
      "fallback_attempts",
      "renderer_types",
      "redaction_check",
      "negative_probe"
    ],
    "terminate_on": [
      "login_required",
      "members_only",
      "age_restricted"
    ],
    "degraded_fallbacks": {
      "ytdlp_ytsearch": "video-only search fallback; does not satisfy mixed-renderer search contract unless caller accepts degraded results",
      "ytdlp_flat_playlist": "flat video listing fallback; playlist/channel metadata may be incomplete",
      "ytdlp_comments": "comment fallback; reply shape can differ from Innertube renderer fixtures",
      "ytdlp_write_sub": "subtitle fallback with --skip-download; never download media"
    }
  },
  "fallback_nodes": [
    {
      "id": "direct_search_html",
      "path_type": "api"
    },
    {
      "id": "browser_search_dom",
      "path_type": "browser"
    },
    {
      "id": "screenshot_search_state",
      "path_type": "browser"
    },
    {
      "id": "browser_filter_dialog",
      "path_type": "browser"
    },
    {
      "id": "direct_search_html_filter_renderers",
      "path_type": "api"
    },
    {
      "id": "browser_click_chip_and_capture_request",
      "path_type": "browser"
    },
    {
      "id": "api_google_youtube_suggest",
      "path_type": "api"
    },
    {
      "id": "browser_searchbox_suggestions",
      "path_type": "browser"
    },
    {
      "id": "api_browse_channel_search",
      "path_type": "api"
    },
    {
      "id": "browser_channel_search_dom",
      "path_type": "browser"
    },
    {
      "id": "direct_watch_player_global",
      "path_type": "api"
    },
    {
      "id": "browser_watch_dom",
      "path_type": "browser"
    },
    {
      "id": "direct_watch_initial_data",
      "path_type": "api"
    },
    {
      "id": "screenshot_panel_state",
      "path_type": "browser"
    },
    {
      "id": "browser_comments_dom",
      "path_type": "browser"
    },
    {
      "id": "raw_entity_key_capture",
      "path_type": "api"
    },
    {
      "id": "browser_transcript_dom",
      "path_type": "browser"
    },
    {
      "id": "timedtext_non_empty_body_probe",
      "path_type": "api"
    },
    {
      "id": "unavailable_with_caption_metadata",
      "path_type": "local"
    },
    {
      "id": "browser_related_rail_dom",
      "path_type": "browser"
    },
    {
      "id": "browser_chapter_panel_dom",
      "path_type": "browser"
    },
    {
      "id": "browser_share_dialog_dom",
      "path_type": "browser"
    },
    {
      "id": "screenshot_action_state",
      "path_type": "browser"
    },
    {
      "id": "legacy_user_rss",
      "path_type": "static"
    },
    {
      "id": "api_browse_channel",
      "path_type": "api"
    },
    {
      "id": "browser_channel_dom",
      "path_type": "browser"
    },
    {
      "id": "thumbnail_maxresdefault",
      "path_type": "static"
    },
    {
      "id": "thumbnail_hqdefault",
      "path_type": "static"
    },
    {
      "id": "thumbnail_mqdefault",
      "path_type": "static"
    },
    {
      "id": "thumbnail_default",
      "path_type": "static"
    },
    {
      "id": "browser_search_scroll",
      "path_type": "browser"
    },
    {
      "id": "direct_channel_html",
      "path_type": "api"
    },
    {
      "id": "browser_channel_about_dom",
      "path_type": "browser"
    },
    {
      "id": "browser_channel_videos_dom",
      "path_type": "browser"
    },
    {
      "id": "browser_channel_shorts_dom",
      "path_type": "browser"
    },
    {
      "id": "browser_channel_playlists_dom",
      "path_type": "browser"
    },
    {
      "id": "browser_channel_community_dom",
      "path_type": "browser"
    },
    {
      "id": "browser_channel_streams_dom",
      "path_type": "browser"
    },
    {
      "id": "direct_playlist_html",
      "path_type": "api"
    },
    {
      "id": "browser_playlist_dom",
      "path_type": "browser"
    },
    {
      "id": "direct_trending_html",
      "path_type": "api"
    },
    {
      "id": "browser_trending_dom",
      "path_type": "browser"
    },
    {
      "id": "direct_hashtag_html",
      "path_type": "api"
    },
    {
      "id": "browser_hashtag_dom",
      "path_type": "browser"
    },
    {
      "id": "direct_watch_storyboards",
      "path_type": "api"
    },
    {
      "id": "direct_watch_live_status",
      "path_type": "api"
    },
    {
      "id": "static_playlist_feed",
      "path_type": "static"
    },
    {
      "id": "ytdlp_dump_json",
      "path_type": "local"
    },
    {
      "id": "ytdlp_flat_playlist",
      "path_type": "local"
    },
    {
      "id": "ytdlp_comments",
      "path_type": "local"
    },
    {
      "id": "ytdlp_write_sub",
      "path_type": "local"
    },
    {
      "id": "ytdlp_ytsearch",
      "path_type": "local"
    },
    {
      "id": "ytdlp_channel_dump",
      "path_type": "local"
    }
  ],
  "browser_harness_primitives": [
    {
      "name": "endpoint_info",
      "path_type": "local",
      "use": "record connected backend"
    },
    {
      "name": "browser_backend_info",
      "path_type": "local",
      "use": "record browser capability"
    },
    {
      "name": "diagnose_url_capability",
      "path_type": "browser",
      "use": "detect blank, blocked, or challenged YouTube pages"
    },
    {
      "name": "detect_block_page",
      "path_type": "local",
      "use": "classify fetched HTML/text as usable, blank, denied, or challenged"
    },
    {
      "name": "discover_local_cdp_endpoints",
      "path_type": "local",
      "use": "setup/debug helper when the browser endpoint is unknown"
    },
    {
      "name": "http_get",
      "path_type": "api",
      "use": "public static pages, oEmbed, RSS, thumbnails, initial HTML"
    },
    {
      "name": "seed_browser_session",
      "path_type": "browser",
      "use": "establish same-domain browser state without logging cookies"
    },
    {
      "name": "http_get_browser_session",
      "path_type": "hybrid",
      "use": "same-domain HTTP with browser-established cookies; do not log cookie headers"
    },
    {
      "name": "http_get_browser_session_response",
      "path_type": "hybrid",
      "use": "same-domain HTTP with status/header receipt"
    },
    {
      "name": "fetch_with_browser_session",
      "path_type": "hybrid",
      "use": "same-domain HTTP using browser-established state"
    },
    {
      "name": "new_tab",
      "path_type": "browser",
      "use": "first navigation without overwriting user's active tab"
    },
    {
      "name": "goto_url",
      "path_type": "browser",
      "use": "same-tab navigation only after the agent owns the active YouTube tab"
    },
    {
      "name": "wait_for_load",
      "path_type": "browser",
      "use": "navigation load gate"
    },
    {
      "name": "wait_for_load_js",
      "path_type": "browser",
      "use": "JavaScript load-state fallback"
    },
    {
      "name": "wait",
      "path_type": "browser",
      "use": "short hydration wait after YouTube load"
    },
    {
      "name": "wait_for_content",
      "path_type": "browser",
      "use": "distinguish usable content from challenge shells"
    },
    {
      "name": "capture_screenshot",
      "path_type": "browser",
      "use": "verify visible state before and after actions"
    },
    {
      "name": "capture_screenshot_trace",
      "path_type": "browser",
      "use": "debug transient menus, panels, and hydration changes"
    },
    {
      "name": "click_at_xy",
      "path_type": "browser",
      "use": "operate visible controls through compositor-level events"
    },
    {
      "name": "type_text",
      "path_type": "browser",
      "use": "search boxes and UI inputs"
    },
    {
      "name": "press_key",
      "path_type": "browser",
      "use": "keyboard commit and navigation"
    },
    {
      "name": "dispatch_key",
      "path_type": "browser",
      "use": "selector-targeted keyboard fallback"
    },
    {
      "name": "scroll",
      "path_type": "browser",
      "use": "hydrate comments, related rails, and long panels"
    },
    {
      "name": "js",
      "path_type": "browser",
      "use": "read ytcfg, ytInitialPlayerResponse, ytInitialData, and DOM state"
    },
    {
      "name": "page_info",
      "path_type": "browser",
      "use": "receipt for active URL/title/viewport"
    },
    {
      "name": "page_info_js",
      "path_type": "browser",
      "use": "JavaScript-backed page receipt when target metadata is insufficient"